

================================================================
== Vitis HLS Report for 'FIR_HLS_Pipeline_VITIS_LOOP_69_2'
================================================================
* Date:           Tue Nov  4 00:15:12 2025

* Version:        2024.2 (Build 5238294 on Nov  8 2024)
* Project:        FIR_v5
* Solution:       hls (Vivado IP Flow Target)
* Product family: zynquplus
* Target device:  xck26-sfvc784-2LV-c


================================================================
== Performance Estimates
================================================================
+ Timing: 
    * Summary: 
    +--------+----------+----------+------------+
    |  Clock |  Target  | Estimated| Uncertainty|
    +--------+----------+----------+------------+
    |ap_clk  |  10.00 ns|  1.527 ns|     2.70 ns|
    +--------+----------+----------+------------+

+ Latency: 
    * Summary: 
    +---------+---------+-----------+-----------+-----+-----+------------------------------------------------+
    |  Latency (cycles) |   Latency (absolute)  |  Interval |                    Pipeline                    |
    |   min   |   max   |    min    |    max    | min | max |                      Type                      |
    +---------+---------+-----------+-----------+-----+-----+------------------------------------------------+
    |        6|        6|  60.000 ns|  60.000 ns|    5|    5|  loop auto-rewind stp (delay=0 clock cycles(s))|
    +---------+---------+-----------+-----------+-----+-----+------------------------------------------------+

    + Detail: 
        * Instance: 
        N/A

        * Loop: 
        +-------------------+---------+---------+----------+-----------+-----------+------+----------+
        |                   |  Latency (cycles) | Iteration|  Initiation Interval  | Trip |          |
        |     Loop Name     |   min   |   max   |  Latency |  achieved |   target  | Count| Pipelined|
        +-------------------+---------+---------+----------+-----------+-----------+------+----------+
        |- VITIS_LOOP_69_2  |        4|        4|         2|          1|          1|     4|       yes|
        +-------------------+---------+---------+----------+-----------+-----------+------+----------+

============================================================
+ Verbose Summary: Synthesis Manager
============================================================
InlineROM: 1
ExposeGlobal: 0
============================================================
+ Verbose Summary: CDFG Model
============================================================
IsTopModel: 0
ResetActiveHigh: 1
IsCombinational: 0
IsDatapathOnly: 0
HasWiredReturn: 1
HasMFsm: 2
HasVarLatency: 1
IsPipeline: 0
IsRtlPipelined: 0
IsInstanceOverlapped: 0
IsDontTouch: 0
HasImplIP: 0
IsGatedGlobalClock: 0

+ Individual pipeline summary: 
  * Pipeline-0: initiation interval (II) = 1, depth = 2


============================================================
+ Verbose Summary: Schedule
============================================================
* Number of FSM states : 2
* Pipeline : 1
  Pipeline-0 : II = 1, D = 2, States = { 1 2 }
* Dataflow Pipeline: 0

* FSM state transitions: 
1 --> 2 
2 --> 

* FSM state operations: 

State 1 <SV = 0> <Delay = 1.52>
ST_1 : Operation 5 [1/1] (0.00ns)   --->   "%i_1 = alloca i32 1" [FIR_HLS.cpp:69->FIR_HLS.cpp:32]   --->   Operation 5 'alloca' 'i_1' <Predicate = true> <Delay = 0.00>
ST_1 : Operation 6 [1/1] (0.42ns)   --->   "%store_ln69 = store i3 1, i3 %i_1" [FIR_HLS.cpp:69->FIR_HLS.cpp:32]   --->   Operation 6 'store' 'store_ln69' <Predicate = true> <Delay = 0.42>
ST_1 : Operation 7 [1/1] (0.00ns)   --->   "%br_ln0 = br void %for.inc19.i"   --->   Operation 7 'br' 'br_ln0' <Predicate = true> <Delay = 0.00>
ST_1 : Operation 8 [1/1] (0.00ns)   --->   "%i = load i3 %i_1" [FIR_HLS.cpp:69->FIR_HLS.cpp:32]   --->   Operation 8 'load' 'i' <Predicate = true> <Delay = 0.00>
ST_1 : Operation 9 [1/1] (0.67ns)   --->   "%icmp_ln69 = icmp_eq  i3 %i, i3 5" [FIR_HLS.cpp:69->FIR_HLS.cpp:32]   --->   Operation 9 'icmp' 'icmp_ln69' <Predicate = true> <Delay = 0.67> <CoreInst = "Cmp">   --->   Core 9 'Cmp' <Latency = 0> <II = 1> <Delay = 0.67> <FuncUnit> <Opcode : 'seteq' 'setne' 'setle' 'setge' 'setlt' 'setgt'> <InPorts = 2> <OutPorts = 1>
ST_1 : Operation 10 [1/1] (0.00ns)   --->   "%br_ln69 = br i1 %icmp_ln69, void %for.inc19.i.split, void %_Z10FIR_filterP8ap_fixedILi32ELi1EL9ap_q_mode5EL9ap_o_mode3ELi0EEPKS_ILi16ELi1ELS0_5ELS1_3ELi0EEiS4_.exit.exitStub" [FIR_HLS.cpp:69->FIR_HLS.cpp:32]   --->   Operation 10 'br' 'br_ln69' <Predicate = true> <Delay = 0.00>
ST_1 : Operation 11 [1/1] (0.00ns)   --->   "%zext_ln69 = zext i3 %i" [FIR_HLS.cpp:69->FIR_HLS.cpp:32]   --->   Operation 11 'zext' 'zext_ln69' <Predicate = (!icmp_ln69)> <Delay = 0.00>
ST_1 : Operation 12 [1/1] (0.00ns)   --->   "%trunc_ln69 = trunc i3 %i" [FIR_HLS.cpp:69->FIR_HLS.cpp:32]   --->   Operation 12 'trunc' 'trunc_ln69' <Predicate = (!icmp_ln69)> <Delay = 0.00>
ST_1 : Operation 13 [1/1] (0.00ns)   --->   "%H_filter_FIR_int_41_addr = getelementptr i32 %H_filter_FIR_int_41, i64 0, i64 %zext_ln69" [FIR_HLS.cpp:70->FIR_HLS.cpp:32]   --->   Operation 13 'getelementptr' 'H_filter_FIR_int_41_addr' <Predicate = (!icmp_ln69)> <Delay = 0.00>
ST_1 : Operation 14 [2/2] (0.67ns)   --->   "%H_filter_FIR_int_41_load = load i3 %H_filter_FIR_int_41_addr" [FIR_HLS.cpp:70->FIR_HLS.cpp:32]   --->   Operation 14 'load' 'H_filter_FIR_int_41_load' <Predicate = (!icmp_ln69)> <Delay = 0.67> <CoreInst = "RAM">   --->   Core 82 'RAM' <Latency = 1> <II = 1> <Delay = 0.67> <Storage> <Opcode : 'load' 'store'> <Ports = 2> <Width = 32> <Depth = 5> <RAM>
ST_1 : Operation 15 [1/1] (0.67ns)   --->   "%add_ln69 = add i3 %i, i3 1" [FIR_HLS.cpp:69->FIR_HLS.cpp:32]   --->   Operation 15 'add' 'add_ln69' <Predicate = (!icmp_ln69)> <Delay = 0.67> <CoreInst = "Adder">   --->   Core 1 'Adder' <Latency = 0> <II = 1> <Delay = 0.67> <FuncUnit> <Opcode : 'add' 'sub'> <InPorts = 2> <OutPorts = 1>
ST_1 : Operation 16 [1/1] (0.42ns)   --->   "%store_ln69 = store i3 %add_ln69, i3 %i_1" [FIR_HLS.cpp:69->FIR_HLS.cpp:32]   --->   Operation 16 'store' 'store_ln69' <Predicate = (!icmp_ln69)> <Delay = 0.42>
ST_1 : Operation 26 [1/1] (0.42ns)   --->   "%ret_ln0 = ret"   --->   Operation 26 'ret' 'ret_ln0' <Predicate = (icmp_ln69)> <Delay = 0.42>

State 2 <SV = 1> <Delay = 1.35>
ST_2 : Operation 17 [1/1] (0.00ns)   --->   "%specpipeline_ln69 = specpipeline void @_ssdm_op_SpecPipeline, i32 4294967295, i32 0, i32 0, i32 0, void @empty_1" [FIR_HLS.cpp:69->FIR_HLS.cpp:32]   --->   Operation 17 'specpipeline' 'specpipeline_ln69' <Predicate = true> <Delay = 0.00>
ST_2 : Operation 18 [1/1] (0.00ns)   --->   "%speclooptripcount_ln69 = speclooptripcount void @_ssdm_op_SpecLoopTripCount, i64 4, i64 4, i64 4" [FIR_HLS.cpp:69->FIR_HLS.cpp:32]   --->   Operation 18 'speclooptripcount' 'speclooptripcount_ln69' <Predicate = true> <Delay = 0.00>
ST_2 : Operation 19 [1/1] (0.00ns)   --->   "%specloopname_ln69 = specloopname void @_ssdm_op_SpecLoopName, void @empty_4" [FIR_HLS.cpp:69->FIR_HLS.cpp:32]   --->   Operation 19 'specloopname' 'specloopname_ln69' <Predicate = true> <Delay = 0.00>
ST_2 : Operation 20 [1/1] (0.54ns)   --->   "%add_ln70 = add i2 %trunc_ln69, i2 3" [FIR_HLS.cpp:70->FIR_HLS.cpp:32]   --->   Operation 20 'add' 'add_ln70' <Predicate = true> <Delay = 0.54> <CoreInst = "Adder">   --->   Core 1 'Adder' <Latency = 0> <II = 1> <Delay = 0.54> <FuncUnit> <Opcode : 'add' 'sub'> <InPorts = 2> <OutPorts = 1>
ST_2 : Operation 21 [1/1] (0.00ns)   --->   "%zext_ln70 = zext i2 %add_ln70" [FIR_HLS.cpp:70->FIR_HLS.cpp:32]   --->   Operation 21 'zext' 'zext_ln70' <Predicate = true> <Delay = 0.00>
ST_2 : Operation 22 [1/1] (0.00ns)   --->   "%H_filter_FIR_int_41_addr_1 = getelementptr i32 %H_filter_FIR_int_41, i64 0, i64 %zext_ln70" [FIR_HLS.cpp:70->FIR_HLS.cpp:32]   --->   Operation 22 'getelementptr' 'H_filter_FIR_int_41_addr_1' <Predicate = true> <Delay = 0.00>
ST_2 : Operation 23 [1/2] ( I:0.67ns O:0.67ns )   --->   "%H_filter_FIR_int_41_load = load i3 %H_filter_FIR_int_41_addr" [FIR_HLS.cpp:70->FIR_HLS.cpp:32]   --->   Operation 23 'load' 'H_filter_FIR_int_41_load' <Predicate = true> <Delay = 0.67> <CoreInst = "RAM">   --->   Core 82 'RAM' <Latency = 1> <II = 1> <Delay = 0.67> <Storage> <Opcode : 'load' 'store'> <Ports = 2> <Width = 32> <Depth = 5> <RAM>
ST_2 : Operation 24 [1/1] ( I:0.67ns O:0.67ns )   --->   "%store_ln70 = store i32 %H_filter_FIR_int_41_load, i3 %H_filter_FIR_int_41_addr_1" [FIR_HLS.cpp:70->FIR_HLS.cpp:32]   --->   Operation 24 'store' 'store_ln70' <Predicate = true> <Delay = 0.67> <CoreInst = "RAM">   --->   Core 82 'RAM' <Latency = 1> <II = 1> <Delay = 0.67> <Storage> <Opcode : 'load' 'store'> <Ports = 2> <Width = 32> <Depth = 5> <RAM>
ST_2 : Operation 25 [1/1] (0.00ns)   --->   "%br_ln69 = br void %for.inc19.i" [FIR_HLS.cpp:69->FIR_HLS.cpp:32]   --->   Operation 25 'br' 'br_ln69' <Predicate = true> <Delay = 0.00>


============================================================
+ Verbose Summary: Timing violations
============================================================
Target clock period: 10.000ns, clock uncertainty: 2.700ns.

 <State 1>: 1.527ns
The critical path consists of the following:
	'store' operation 0 bit ('store_ln69', FIR_HLS.cpp:69->FIR_HLS.cpp:32) of constant 1 on local variable 'i', FIR_HLS.cpp:69->FIR_HLS.cpp:32 [3]  (0.427 ns)
	'load' operation 3 bit ('i', FIR_HLS.cpp:69->FIR_HLS.cpp:32) on local variable 'i', FIR_HLS.cpp:69->FIR_HLS.cpp:32 [6]  (0.000 ns)
	'add' operation 3 bit ('add_ln69', FIR_HLS.cpp:69->FIR_HLS.cpp:32) [21]  (0.673 ns)
	'store' operation 0 bit ('store_ln69', FIR_HLS.cpp:69->FIR_HLS.cpp:32) of variable 'add_ln69', FIR_HLS.cpp:69->FIR_HLS.cpp:32 on local variable 'i', FIR_HLS.cpp:69->FIR_HLS.cpp:32 [22]  (0.427 ns)

 <State 2>: 1.354ns
The critical path consists of the following:
	'load' operation 32 bit ('H_filter_FIR_int_41_load', FIR_HLS.cpp:70->FIR_HLS.cpp:32) on array 'H_filter_FIR_int_41' [19]  (0.677 ns)
	'store' operation 0 bit ('store_ln70', FIR_HLS.cpp:70->FIR_HLS.cpp:32) of variable 'H_filter_FIR_int_41_load', FIR_HLS.cpp:70->FIR_HLS.cpp:32 on array 'H_filter_FIR_int_41' [20]  (0.677 ns)


============================================================
+ Verbose Summary: Binding
============================================================
N/A
* FSMD analyzer results:
  - Output states:
 - Input state : 
  - Chain level:
	State 1
	State 2


============================================================
+ Verbose Summary: Datapath Resource usage 
============================================================
N/A
