

================================================================
== Vitis HLS Report for 'FIR_HLS_Pipeline_VITIS_LOOP_20_1'
================================================================
* Date:           Mon Nov 10 23:02:11 2025

* Version:        2024.2 (Build 5238294 on Nov  8 2024)
* Project:        Transposed_FIR_HLS
* Solution:       hls (Vivado IP Flow Target)
* Product family: zynquplus
* Target device:  xck26-sfvc784-2LV-c


================================================================
== Performance Estimates
================================================================
+ Timing: 
    * Summary: 
    +--------+----------+----------+------------+
    |  Clock |  Target  | Estimated| Uncertainty|
    +--------+----------+----------+------------+
    |ap_clk  |  10.00 ns|  5.870 ns|     2.70 ns|
    +--------+----------+----------+------------+

+ Latency: 
    * Summary: 
    +---------+---------+----------+----------+-----+-----+------------------------------------------------+
    |  Latency (cycles) |  Latency (absolute) |  Interval |                    Pipeline                    |
    |   min   |   max   |    min   |    max   | min | max |                      Type                      |
    +---------+---------+----------+----------+-----+-----+------------------------------------------------+
    |      393|      393|  3.930 us|  3.930 us|  391|  391|  loop auto-rewind stp (delay=0 clock cycles(s))|
    +---------+---------+----------+----------+-----+-----+------------------------------------------------+

    + Detail: 
        * Instance: 
        N/A

        * Loop: 
        +-------------------+---------+---------+----------+-----------+-----------+------+----------+
        |                   |  Latency (cycles) | Iteration|  Initiation Interval  | Trip |          |
        |     Loop Name     |   min   |   max   |  Latency |  achieved |   target  | Count| Pipelined|
        +-------------------+---------+---------+----------+-----------+-----------+------+----------+
        |- VITIS_LOOP_20_1  |      391|      391|         2|          1|          1|   391|       yes|
        +-------------------+---------+---------+----------+-----------+-----------+------+----------+

============================================================
+ Verbose Summary: Synthesis Manager
============================================================
InlineROM: 1
ExposeGlobal: 0
============================================================
+ Verbose Summary: CDFG Model
============================================================
IsTopModel: 0
ResetActiveHigh: 1
IsCombinational: 0
IsDatapathOnly: 0
HasWiredReturn: 1
HasMFsm: 2
HasVarLatency: 1
IsPipeline: 0
IsRtlPipelined: 0
IsInstanceOverlapped: 0
IsDontTouch: 0
HasImplIP: 0
IsGatedGlobalClock: 0

+ Individual pipeline summary: 
  * Pipeline-0: initiation interval (II) = 1, depth = 2


============================================================
+ Verbose Summary: Schedule
============================================================
* Number of FSM states : 2
* Pipeline : 1
  Pipeline-0 : II = 1, D = 2, States = { 1 2 }
* Dataflow Pipeline: 0

* FSM state transitions: 
1 --> 2 
2 --> 

* FSM state operations: 

State 1 <SV = 0> <Delay = 1.97>
ST_1 : Operation 5 [1/1] (0.00ns)   --->   "%i1 = alloca i32 1"   --->   Operation 5 'alloca' 'i1' <Predicate = true> <Delay = 0.00>
ST_1 : Operation 6 [1/1] (0.00ns)   --->   "%sext_ln20_read = read i16 @_ssdm_op_Read.ap_auto.i16, i16 %sext_ln20"   --->   Operation 6 'read' 'sext_ln20_read' <Predicate = true> <Delay = 0.00>
ST_1 : Operation 7 [1/1] (0.00ns)   --->   "%sext_ln20_cast = sext i16 %sext_ln20_read"   --->   Operation 7 'sext' 'sext_ln20_cast' <Predicate = true> <Delay = 0.00>
ST_1 : Operation 8 [1/1] (0.42ns)   --->   "%store_ln0 = store i9 1, i9 %i1"   --->   Operation 8 'store' 'store_ln0' <Predicate = true> <Delay = 0.42>
ST_1 : Operation 9 [1/1] (0.00ns)   --->   "%br_ln0 = br void %for.body.i.split"   --->   Operation 9 'br' 'br_ln0' <Predicate = true> <Delay = 0.00>
ST_1 : Operation 10 [1/1] (0.00ns)   --->   "%i1_load = load i9 %i1" [FIR_HLS.cpp:21->FIR_HLS.cpp:11]   --->   Operation 10 'load' 'i1_load' <Predicate = true> <Delay = 0.00>
ST_1 : Operation 11 [1/1] (0.00ns)   --->   "%zext_ln20 = zext i9 %i1_load" [FIR_HLS.cpp:20->FIR_HLS.cpp:11]   --->   Operation 11 'zext' 'zext_ln20' <Predicate = true> <Delay = 0.00>
ST_1 : Operation 12 [1/1] (0.00ns)   --->   "%b_FIR_addr = getelementptr i14 %b_FIR, i64 0, i64 %zext_ln20" [FIR_HLS.cpp:21->FIR_HLS.cpp:11]   --->   Operation 12 'getelementptr' 'b_FIR_addr' <Predicate = true> <Delay = 0.00>
ST_1 : Operation 13 [2/2] (1.23ns)   --->   "%b_FIR_load = load i9 %b_FIR_addr" [FIR_HLS.cpp:21->FIR_HLS.cpp:11]   --->   Operation 13 'load' 'b_FIR_load' <Predicate = true> <Delay = 1.23> <CoreInst = "ROM">   --->   Core 100 'ROM' <Latency = 1> <II = 1> <Delay = 1.23> <Storage> <Opcode : 'load'> <Ports = 0> <Width = 14> <Depth = 392> <ROM>
ST_1 : Operation 14 [1/1] (0.00ns)   --->   "%H_accu_FIR_addr = getelementptr i32 %H_accu_FIR, i64 0, i64 %zext_ln20" [FIR_HLS.cpp:21->FIR_HLS.cpp:11]   --->   Operation 14 'getelementptr' 'H_accu_FIR_addr' <Predicate = true> <Delay = 0.00>
ST_1 : Operation 15 [2/2] (1.23ns)   --->   "%H_accu_FIR_load = load i9 %H_accu_FIR_addr" [FIR_HLS.cpp:21->FIR_HLS.cpp:11]   --->   Operation 15 'load' 'H_accu_FIR_load' <Predicate = true> <Delay = 1.23> <CoreInst = "RAM">   --->   Core 82 'RAM' <Latency = 1> <II = 1> <Delay = 1.23> <Storage> <Opcode : 'load' 'store'> <Ports = 2> <Width = 32> <Depth = 392> <RAM>
ST_1 : Operation 16 [1/1] (0.77ns)   --->   "%i = add i9 %i1_load, i9 1" [FIR_HLS.cpp:20->FIR_HLS.cpp:11]   --->   Operation 16 'add' 'i' <Predicate = true> <Delay = 0.77> <CoreInst = "Adder">   --->   Core 1 'Adder' <Latency = 0> <II = 1> <Delay = 0.77> <FuncUnit> <Opcode : 'add' 'sub'> <InPorts = 2> <OutPorts = 1>
ST_1 : Operation 17 [1/1] (0.77ns)   --->   "%icmp_ln20 = icmp_eq  i9 %i, i9 392" [FIR_HLS.cpp:20->FIR_HLS.cpp:11]   --->   Operation 17 'icmp' 'icmp_ln20' <Predicate = true> <Delay = 0.77> <CoreInst = "Cmp">   --->   Core 9 'Cmp' <Latency = 0> <II = 1> <Delay = 0.77> <FuncUnit> <Opcode : 'seteq' 'setne' 'setle' 'setge' 'setlt' 'setgt'> <InPorts = 2> <OutPorts = 1>
ST_1 : Operation 18 [1/1] (0.42ns)   --->   "%store_ln20 = store i9 %i, i9 %i1" [FIR_HLS.cpp:20->FIR_HLS.cpp:11]   --->   Operation 18 'store' 'store_ln20' <Predicate = true> <Delay = 0.42>
ST_1 : Operation 19 [1/1] (0.00ns)   --->   "%br_ln20 = br i1 %icmp_ln20, void %for.body.i.split, void %_Z10FIR_filterP8ap_fixedILi32ELi1EL9ap_q_mode5EL9ap_o_mode3ELi0EEPKS_ILi16ELi1ELS0_5ELS1_3ELi0EEiS4_.exit.exitStub" [FIR_HLS.cpp:20->FIR_HLS.cpp:11]   --->   Operation 19 'br' 'br_ln20' <Predicate = true> <Delay = 0.00>

State 2 <SV = 1> <Delay = 5.87>
ST_2 : Operation 20 [1/1] (0.00ns)   --->   "%specpipeline_ln20 = specpipeline void @_ssdm_op_SpecPipeline, i32 4294967295, i32 0, i32 0, i32 0, void @empty_1" [FIR_HLS.cpp:20->FIR_HLS.cpp:11]   --->   Operation 20 'specpipeline' 'specpipeline_ln20' <Predicate = true> <Delay = 0.00>
ST_2 : Operation 21 [1/1] (0.00ns)   --->   "%speclooptripcount_ln20 = speclooptripcount void @_ssdm_op_SpecLoopTripCount, i64 391, i64 391, i64 391" [FIR_HLS.cpp:20->FIR_HLS.cpp:11]   --->   Operation 21 'speclooptripcount' 'speclooptripcount_ln20' <Predicate = true> <Delay = 0.00>
ST_2 : Operation 22 [1/1] (0.00ns)   --->   "%specloopname_ln20 = specloopname void @_ssdm_op_SpecLoopName, void @empty_4" [FIR_HLS.cpp:20->FIR_HLS.cpp:11]   --->   Operation 22 'specloopname' 'specloopname_ln20' <Predicate = true> <Delay = 0.00>
ST_2 : Operation 23 [1/2] ( I:1.23ns O:1.23ns )   --->   "%b_FIR_load = load i9 %b_FIR_addr" [FIR_HLS.cpp:21->FIR_HLS.cpp:11]   --->   Operation 23 'load' 'b_FIR_load' <Predicate = true> <Delay = 1.23> <CoreInst = "ROM">   --->   Core 100 'ROM' <Latency = 1> <II = 1> <Delay = 1.23> <Storage> <Opcode : 'load'> <Ports = 0> <Width = 14> <Depth = 392> <ROM>
ST_2 : Operation 24 [1/2] ( I:1.23ns O:1.23ns )   --->   "%H_accu_FIR_load = load i9 %H_accu_FIR_addr" [FIR_HLS.cpp:21->FIR_HLS.cpp:11]   --->   Operation 24 'load' 'H_accu_FIR_load' <Predicate = true> <Delay = 1.23> <CoreInst = "RAM">   --->   Core 82 'RAM' <Latency = 1> <II = 1> <Delay = 1.23> <Storage> <Opcode : 'load' 'store'> <Ports = 2> <Width = 32> <Depth = 392> <RAM>
ST_2 : Operation 25 [1/1] (0.00ns)   --->   "%sext_ln21 = sext i14 %b_FIR_load" [FIR_HLS.cpp:21->FIR_HLS.cpp:11]   --->   Operation 25 'sext' 'sext_ln21' <Predicate = true> <Delay = 0.00>
ST_2 : Operation 26 [1/1] (2.38ns)   --->   "%mul_ln21 = mul i30 %sext_ln20_cast, i30 %sext_ln21" [FIR_HLS.cpp:21->FIR_HLS.cpp:11]   --->   Operation 26 'mul' 'mul_ln21' <Predicate = true> <Delay = 2.38> <CoreInst = "Multiplier">   --->   Core 3 'Multiplier' <Latency = 0> <II = 1> <Delay = 2.38> <FuncUnit> <Opcode : 'mul'> <InPorts = 2> <OutPorts = 1>
ST_2 : Operation 27 [1/1] (0.00ns)   --->   "%tmp = bitconcatenate i31 @_ssdm_op_BitConcatenate.i31.i30.i1, i30 %mul_ln21, i1 0" [FIR_HLS.cpp:21->FIR_HLS.cpp:11]   --->   Operation 27 'bitconcatenate' 'tmp' <Predicate = true> <Delay = 0.00>
ST_2 : Operation 28 [1/1] (0.00ns)   --->   "%sext_ln21_1 = sext i31 %tmp" [FIR_HLS.cpp:21->FIR_HLS.cpp:11]   --->   Operation 28 'sext' 'sext_ln21_1' <Predicate = true> <Delay = 0.00>
ST_2 : Operation 29 [1/1] (1.01ns)   --->   "%add_ln21 = add i32 %H_accu_FIR_load, i32 %sext_ln21_1" [FIR_HLS.cpp:21->FIR_HLS.cpp:11]   --->   Operation 29 'add' 'add_ln21' <Predicate = true> <Delay = 1.01> <CoreInst = "Adder">   --->   Core 1 'Adder' <Latency = 0> <II = 1> <Delay = 1.01> <FuncUnit> <Opcode : 'add' 'sub'> <InPorts = 2> <OutPorts = 1>
ST_2 : Operation 30 [1/1] (0.77ns)   --->   "%add_ln21_1 = add i9 %i1_load, i9 511" [FIR_HLS.cpp:21->FIR_HLS.cpp:11]   --->   Operation 30 'add' 'add_ln21_1' <Predicate = true> <Delay = 0.77> <CoreInst = "Adder">   --->   Core 1 'Adder' <Latency = 0> <II = 1> <Delay = 0.77> <FuncUnit> <Opcode : 'add' 'sub'> <InPorts = 2> <OutPorts = 1>
ST_2 : Operation 31 [1/1] (0.00ns)   --->   "%zext_ln21 = zext i9 %add_ln21_1" [FIR_HLS.cpp:21->FIR_HLS.cpp:11]   --->   Operation 31 'zext' 'zext_ln21' <Predicate = true> <Delay = 0.00>
ST_2 : Operation 32 [1/1] (0.00ns)   --->   "%H_accu_FIR_addr_1 = getelementptr i32 %H_accu_FIR, i64 0, i64 %zext_ln21" [FIR_HLS.cpp:21->FIR_HLS.cpp:11]   --->   Operation 32 'getelementptr' 'H_accu_FIR_addr_1' <Predicate = true> <Delay = 0.00>
ST_2 : Operation 33 [1/1] ( I:1.23ns O:1.23ns )   --->   "%store_ln21 = store i32 %add_ln21, i9 %H_accu_FIR_addr_1" [FIR_HLS.cpp:21->FIR_HLS.cpp:11]   --->   Operation 33 'store' 'store_ln21' <Predicate = true> <Delay = 1.23> <CoreInst = "RAM">   --->   Core 82 'RAM' <Latency = 1> <II = 1> <Delay = 1.23> <Storage> <Opcode : 'load' 'store'> <Ports = 2> <Width = 32> <Depth = 392> <RAM>
ST_2 : Operation 34 [1/1] (0.42ns)   --->   "%ret_ln0 = ret"   --->   Operation 34 'ret' 'ret_ln0' <Predicate = (icmp_ln20)> <Delay = 0.42>


============================================================
+ Verbose Summary: Timing violations
============================================================
Target clock period: 10.000ns, clock uncertainty: 2.700ns.

 <State 1>: 1.979ns
The critical path consists of the following:
	'store' operation 0 bit ('store_ln0') of constant 1 on local variable 'i1' [7]  (0.427 ns)
	'load' operation 9 bit ('i1_load', FIR_HLS.cpp:21->FIR_HLS.cpp:11) on local variable 'i1' [10]  (0.000 ns)
	'add' operation 9 bit ('i', FIR_HLS.cpp:20->FIR_HLS.cpp:11) [28]  (0.776 ns)
	'icmp' operation 1 bit ('icmp_ln20', FIR_HLS.cpp:20->FIR_HLS.cpp:11) [29]  (0.776 ns)

 <State 2>: 5.870ns
The critical path consists of the following:
	'load' operation 14 bit ('b_FIR_load', FIR_HLS.cpp:21->FIR_HLS.cpp:11) on array 'b_FIR' [16]  (1.237 ns)
	'mul' operation 30 bit ('mul_ln21', FIR_HLS.cpp:21->FIR_HLS.cpp:11) [20]  (2.380 ns)
	'add' operation 32 bit ('add_ln21', FIR_HLS.cpp:21->FIR_HLS.cpp:11) [23]  (1.016 ns)
	'store' operation 0 bit ('store_ln21', FIR_HLS.cpp:21->FIR_HLS.cpp:11) of variable 'add_ln21', FIR_HLS.cpp:21->FIR_HLS.cpp:11 on array 'H_accu_FIR' [27]  (1.237 ns)


============================================================
+ Verbose Summary: Binding
============================================================
N/A
* FSMD analyzer results:
  - Output states:
 - Input state : 
  - Chain level:
	State 1
	State 2


============================================================
+ Verbose Summary: Datapath Resource usage 
============================================================
N/A
