

================================================================
== Vitis HLS Report for 'Block_entry_b_FIR_dec_int_43_rd_mod_value_fb_proc_Pipeline_VITIS_LOOP_41_1'
================================================================
* Date:           Wed Nov 12 23:19:52 2025

* Version:        2024.2 (Build 5238294 on Nov  8 2024)
* Project:        Multirate_v10
* Solution:       hls (Vivado IP Flow Target)
* Product family: zynquplus
* Target device:  xck26-sfvc784-2LV-c


================================================================
== Performance Estimates
================================================================
+ Timing: 
    * Summary: 
    +--------+----------+----------+------------+
    |  Clock |  Target  | Estimated| Uncertainty|
    +--------+----------+----------+------------+
    |ap_clk  |  10.00 ns|  5.870 ns|     2.70 ns|
    +--------+----------+----------+------------+

+ Latency: 
    * Summary: 
    +---------+---------+----------+----------+-----+-----+------------------------------------------------+
    |  Latency (cycles) |  Latency (absolute) |  Interval |                    Pipeline                    |
    |   min   |   max   |    min   |    max   | min | max |                      Type                      |
    +---------+---------+----------+----------+-----+-----+------------------------------------------------+
    |      118|      118|  1.180 us|  1.180 us|  117|  117|  loop auto-rewind stp (delay=0 clock cycles(s))|
    +---------+---------+----------+----------+-----+-----+------------------------------------------------+

    + Detail: 
        * Instance: 
        N/A

        * Loop: 
        +-------------------+---------+---------+----------+-----------+-----------+------+----------+
        |                   |  Latency (cycles) | Iteration|  Initiation Interval  | Trip |          |
        |     Loop Name     |   min   |   max   |  Latency |  achieved |   target  | Count| Pipelined|
        +-------------------+---------+---------+----------+-----------+-----------+------+----------+
        |- VITIS_LOOP_41_1  |      116|      116|         2|          1|          1|   116|       yes|
        +-------------------+---------+---------+----------+-----------+-----------+------+----------+

============================================================
+ Verbose Summary: Synthesis Manager
============================================================
InlineROM: 1
ExposeGlobal: 0
============================================================
+ Verbose Summary: CDFG Model
============================================================
IsTopModel: 0
ResetActiveHigh: 1
IsCombinational: 0
IsDatapathOnly: 0
HasWiredReturn: 1
HasMFsm: 2
HasVarLatency: 1
IsPipeline: 0
IsRtlPipelined: 0
IsInstanceOverlapped: 0
IsDontTouch: 0
HasImplIP: 0
IsGatedGlobalClock: 0

+ Individual pipeline summary: 
  * Pipeline-0: initiation interval (II) = 1, depth = 2


============================================================
+ Verbose Summary: Schedule
============================================================
* Number of FSM states : 2
* Pipeline : 1
  Pipeline-0 : II = 1, D = 2, States = { 1 2 }
* Dataflow Pipeline: 0

* FSM state transitions: 
1 --> 2 
2 --> 

* FSM state operations: 

State 1 <SV = 0> <Delay = 1.66>
ST_1 : Operation 5 [1/1] (0.00ns)   --->   "%i = alloca i32 1" [FIR_HLS.cpp:41->FIR_HLS.cpp:20->FIR_HLS.cpp:19->FIR_HLS.cpp:18]   --->   Operation 5 'alloca' 'i' <Predicate = true> <Delay = 0.00>
ST_1 : Operation 6 [1/1] (0.00ns)   --->   "%sext_ln42_read = read i16 @_ssdm_op_Read.ap_auto.i16, i16 %sext_ln42"   --->   Operation 6 'read' 'sext_ln42_read' <Predicate = true> <Delay = 0.00>
ST_1 : Operation 7 [1/1] (0.00ns)   --->   "%sext_ln42_cast = sext i16 %sext_ln42_read"   --->   Operation 7 'sext' 'sext_ln42_cast' <Predicate = true> <Delay = 0.00>
ST_1 : Operation 8 [1/1] (0.42ns)   --->   "%store_ln41 = store i7 1, i7 %i" [FIR_HLS.cpp:41->FIR_HLS.cpp:20->FIR_HLS.cpp:19->FIR_HLS.cpp:18]   --->   Operation 8 'store' 'store_ln41' <Predicate = true> <Delay = 0.42>
ST_1 : Operation 9 [1/1] (0.00ns)   --->   "%br_ln0 = br void %for.body.i"   --->   Operation 9 'br' 'br_ln0' <Predicate = true> <Delay = 0.00>
ST_1 : Operation 10 [1/1] (0.00ns)   --->   "%i_4 = load i7 %i" [FIR_HLS.cpp:42->FIR_HLS.cpp:20->FIR_HLS.cpp:19->FIR_HLS.cpp:18]   --->   Operation 10 'load' 'i_4' <Predicate = true> <Delay = 0.00>
ST_1 : Operation 11 [1/1] (0.77ns)   --->   "%icmp_ln41 = icmp_eq  i7 %i_4, i7 117" [FIR_HLS.cpp:41->FIR_HLS.cpp:20->FIR_HLS.cpp:19->FIR_HLS.cpp:18]   --->   Operation 11 'icmp' 'icmp_ln41' <Predicate = true> <Delay = 0.77> <CoreInst = "Cmp">   --->   Core 9 'Cmp' <Latency = 0> <II = 1> <Delay = 0.77> <FuncUnit> <Opcode : 'seteq' 'setne' 'setle' 'setge' 'setlt' 'setgt'> <InPorts = 2> <OutPorts = 1>
ST_1 : Operation 12 [1/1] (0.00ns)   --->   "%empty = speclooptripcount i32 @_ssdm_op_SpecLoopTripCount, i64 116, i64 116, i64 116"   --->   Operation 12 'speclooptripcount' 'empty' <Predicate = true> <Delay = 0.00>
ST_1 : Operation 13 [1/1] (0.00ns)   --->   "%br_ln41 = br i1 %icmp_ln41, void %for.body.split.i, void %FIR_filter.exit.exitStub" [FIR_HLS.cpp:41->FIR_HLS.cpp:20->FIR_HLS.cpp:19->FIR_HLS.cpp:18]   --->   Operation 13 'br' 'br_ln41' <Predicate = true> <Delay = 0.00>
ST_1 : Operation 14 [1/1] (0.00ns)   --->   "%zext_ln41 = zext i7 %i_4" [FIR_HLS.cpp:41->FIR_HLS.cpp:20->FIR_HLS.cpp:19->FIR_HLS.cpp:18]   --->   Operation 14 'zext' 'zext_ln41' <Predicate = (!icmp_ln41)> <Delay = 0.00>
ST_1 : Operation 15 [1/1] (0.00ns)   --->   "%b_FIR_kernel_addr = getelementptr i16 %b_FIR_kernel, i64 0, i64 %zext_ln41" [FIR_HLS.cpp:42->FIR_HLS.cpp:20->FIR_HLS.cpp:19->FIR_HLS.cpp:18]   --->   Operation 15 'getelementptr' 'b_FIR_kernel_addr' <Predicate = (!icmp_ln41)> <Delay = 0.00>
ST_1 : Operation 16 [2/2] (1.23ns)   --->   "%b_FIR_kernel_load = load i7 %b_FIR_kernel_addr" [FIR_HLS.cpp:42->FIR_HLS.cpp:20->FIR_HLS.cpp:19->FIR_HLS.cpp:18]   --->   Operation 16 'load' 'b_FIR_kernel_load' <Predicate = (!icmp_ln41)> <Delay = 1.23> <CoreInst = "ROM">   --->   Core 100 'ROM' <Latency = 1> <II = 1> <Delay = 1.23> <Storage> <Opcode : 'load'> <Ports = 0> <Width = 16> <Depth = 117> <ROM>
ST_1 : Operation 17 [1/1] (0.00ns)   --->   "%H_accu_FIR_kernel_addr = getelementptr i32 %H_accu_FIR_kernel, i64 0, i64 %zext_ln41" [FIR_HLS.cpp:42->FIR_HLS.cpp:20->FIR_HLS.cpp:19->FIR_HLS.cpp:18]   --->   Operation 17 'getelementptr' 'H_accu_FIR_kernel_addr' <Predicate = (!icmp_ln41)> <Delay = 0.00>
ST_1 : Operation 18 [2/2] (1.23ns)   --->   "%H_accu_FIR_kernel_load = load i7 %H_accu_FIR_kernel_addr" [FIR_HLS.cpp:42->FIR_HLS.cpp:20->FIR_HLS.cpp:19->FIR_HLS.cpp:18]   --->   Operation 18 'load' 'H_accu_FIR_kernel_load' <Predicate = (!icmp_ln41)> <Delay = 1.23> <CoreInst = "RAM">   --->   Core 82 'RAM' <Latency = 1> <II = 1> <Delay = 1.23> <Storage> <Opcode : 'load' 'store'> <Ports = 2> <Width = 32> <Depth = 117> <RAM>
ST_1 : Operation 19 [1/1] (0.77ns)   --->   "%add_ln41 = add i7 %i_4, i7 1" [FIR_HLS.cpp:41->FIR_HLS.cpp:20->FIR_HLS.cpp:19->FIR_HLS.cpp:18]   --->   Operation 19 'add' 'add_ln41' <Predicate = (!icmp_ln41)> <Delay = 0.77> <CoreInst = "Adder">   --->   Core 1 'Adder' <Latency = 0> <II = 1> <Delay = 0.77> <FuncUnit> <Opcode : 'add' 'sub'> <InPorts = 2> <OutPorts = 1>
ST_1 : Operation 20 [1/1] (0.42ns)   --->   "%store_ln41 = store i7 %add_ln41, i7 %i" [FIR_HLS.cpp:41->FIR_HLS.cpp:20->FIR_HLS.cpp:19->FIR_HLS.cpp:18]   --->   Operation 20 'store' 'store_ln41' <Predicate = (!icmp_ln41)> <Delay = 0.42>
ST_1 : Operation 34 [1/1] (0.42ns)   --->   "%ret_ln0 = ret"   --->   Operation 34 'ret' 'ret_ln0' <Predicate = (icmp_ln41)> <Delay = 0.42>

State 2 <SV = 1> <Delay = 5.87>
ST_2 : Operation 21 [1/1] (0.00ns)   --->   "%specpipeline_ln41 = specpipeline void @_ssdm_op_SpecPipeline, i32 4294967295, i32 0, i32 0, i32 0, void @empty_1" [FIR_HLS.cpp:41->FIR_HLS.cpp:20->FIR_HLS.cpp:19->FIR_HLS.cpp:18]   --->   Operation 21 'specpipeline' 'specpipeline_ln41' <Predicate = true> <Delay = 0.00>
ST_2 : Operation 22 [1/1] (0.00ns)   --->   "%specloopname_ln41 = specloopname void @_ssdm_op_SpecLoopName, void @empty_5" [FIR_HLS.cpp:41->FIR_HLS.cpp:20->FIR_HLS.cpp:19->FIR_HLS.cpp:18]   --->   Operation 22 'specloopname' 'specloopname_ln41' <Predicate = true> <Delay = 0.00>
ST_2 : Operation 23 [1/2] ( I:1.23ns O:1.23ns )   --->   "%b_FIR_kernel_load = load i7 %b_FIR_kernel_addr" [FIR_HLS.cpp:42->FIR_HLS.cpp:20->FIR_HLS.cpp:19->FIR_HLS.cpp:18]   --->   Operation 23 'load' 'b_FIR_kernel_load' <Predicate = true> <Delay = 1.23> <CoreInst = "ROM">   --->   Core 100 'ROM' <Latency = 1> <II = 1> <Delay = 1.23> <Storage> <Opcode : 'load'> <Ports = 0> <Width = 16> <Depth = 117> <ROM>
ST_2 : Operation 24 [1/2] ( I:1.23ns O:1.23ns )   --->   "%H_accu_FIR_kernel_load = load i7 %H_accu_FIR_kernel_addr" [FIR_HLS.cpp:42->FIR_HLS.cpp:20->FIR_HLS.cpp:19->FIR_HLS.cpp:18]   --->   Operation 24 'load' 'H_accu_FIR_kernel_load' <Predicate = true> <Delay = 1.23> <CoreInst = "RAM">   --->   Core 82 'RAM' <Latency = 1> <II = 1> <Delay = 1.23> <Storage> <Opcode : 'load' 'store'> <Ports = 2> <Width = 32> <Depth = 117> <RAM>
ST_2 : Operation 25 [1/1] (0.00ns)   --->   "%sext_ln42_5 = sext i16 %b_FIR_kernel_load" [FIR_HLS.cpp:42->FIR_HLS.cpp:20->FIR_HLS.cpp:19->FIR_HLS.cpp:18]   --->   Operation 25 'sext' 'sext_ln42_5' <Predicate = true> <Delay = 0.00>
ST_2 : Operation 26 [1/1] (2.38ns)   --->   "%mul_ln42 = mul i31 %sext_ln42_cast, i31 %sext_ln42_5" [FIR_HLS.cpp:42->FIR_HLS.cpp:20->FIR_HLS.cpp:19->FIR_HLS.cpp:18]   --->   Operation 26 'mul' 'mul_ln42' <Predicate = true> <Delay = 2.38> <CoreInst = "Multiplier">   --->   Core 3 'Multiplier' <Latency = 0> <II = 1> <Delay = 2.38> <FuncUnit> <Opcode : 'mul'> <InPorts = 2> <OutPorts = 1>
ST_2 : Operation 27 [1/1] (0.00ns)   --->   "%shl_ln = bitconcatenate i32 @_ssdm_op_BitConcatenate.i32.i31.i1, i31 %mul_ln42, i1 0" [FIR_HLS.cpp:42->FIR_HLS.cpp:20->FIR_HLS.cpp:19->FIR_HLS.cpp:18]   --->   Operation 27 'bitconcatenate' 'shl_ln' <Predicate = true> <Delay = 0.00>
ST_2 : Operation 28 [1/1] (1.01ns)   --->   "%add_ln42 = add i32 %H_accu_FIR_kernel_load, i32 %shl_ln" [FIR_HLS.cpp:42->FIR_HLS.cpp:20->FIR_HLS.cpp:19->FIR_HLS.cpp:18]   --->   Operation 28 'add' 'add_ln42' <Predicate = true> <Delay = 1.01> <CoreInst = "Adder">   --->   Core 1 'Adder' <Latency = 0> <II = 1> <Delay = 1.01> <FuncUnit> <Opcode : 'add' 'sub'> <InPorts = 2> <OutPorts = 1>
ST_2 : Operation 29 [1/1] (0.77ns)   --->   "%add_ln42_3 = add i7 %i_4, i7 127" [FIR_HLS.cpp:42->FIR_HLS.cpp:20->FIR_HLS.cpp:19->FIR_HLS.cpp:18]   --->   Operation 29 'add' 'add_ln42_3' <Predicate = true> <Delay = 0.77> <CoreInst = "Adder">   --->   Core 1 'Adder' <Latency = 0> <II = 1> <Delay = 0.77> <FuncUnit> <Opcode : 'add' 'sub'> <InPorts = 2> <OutPorts = 1>
ST_2 : Operation 30 [1/1] (0.00ns)   --->   "%zext_ln42 = zext i7 %add_ln42_3" [FIR_HLS.cpp:42->FIR_HLS.cpp:20->FIR_HLS.cpp:19->FIR_HLS.cpp:18]   --->   Operation 30 'zext' 'zext_ln42' <Predicate = true> <Delay = 0.00>
ST_2 : Operation 31 [1/1] (0.00ns)   --->   "%H_accu_FIR_kernel_addr_1 = getelementptr i32 %H_accu_FIR_kernel, i64 0, i64 %zext_ln42" [FIR_HLS.cpp:42->FIR_HLS.cpp:20->FIR_HLS.cpp:19->FIR_HLS.cpp:18]   --->   Operation 31 'getelementptr' 'H_accu_FIR_kernel_addr_1' <Predicate = true> <Delay = 0.00>
ST_2 : Operation 32 [1/1] ( I:1.23ns O:1.23ns )   --->   "%store_ln42 = store i32 %add_ln42, i7 %H_accu_FIR_kernel_addr_1" [FIR_HLS.cpp:42->FIR_HLS.cpp:20->FIR_HLS.cpp:19->FIR_HLS.cpp:18]   --->   Operation 32 'store' 'store_ln42' <Predicate = true> <Delay = 1.23> <CoreInst = "RAM">   --->   Core 82 'RAM' <Latency = 1> <II = 1> <Delay = 1.23> <Storage> <Opcode : 'load' 'store'> <Ports = 2> <Width = 32> <Depth = 117> <RAM>
ST_2 : Operation 33 [1/1] (0.00ns)   --->   "%br_ln41 = br void %for.body.i" [FIR_HLS.cpp:41->FIR_HLS.cpp:20->FIR_HLS.cpp:19->FIR_HLS.cpp:18]   --->   Operation 33 'br' 'br_ln41' <Predicate = true> <Delay = 0.00>


============================================================
+ Verbose Summary: Timing violations
============================================================
Target clock period: 10.000ns, clock uncertainty: 2.700ns.

 <State 1>: 1.664ns
The critical path consists of the following:
	'store' operation 0 bit ('store_ln41', FIR_HLS.cpp:41->FIR_HLS.cpp:20->FIR_HLS.cpp:19->FIR_HLS.cpp:18) of constant 1 on local variable 'i', FIR_HLS.cpp:41->FIR_HLS.cpp:20->FIR_HLS.cpp:19->FIR_HLS.cpp:18 [7]  (0.427 ns)
	'load' operation 7 bit ('i', FIR_HLS.cpp:42->FIR_HLS.cpp:20->FIR_HLS.cpp:19->FIR_HLS.cpp:18) on local variable 'i', FIR_HLS.cpp:41->FIR_HLS.cpp:20->FIR_HLS.cpp:19->FIR_HLS.cpp:18 [10]  (0.000 ns)
	'getelementptr' operation 7 bit ('b_FIR_kernel_addr', FIR_HLS.cpp:42->FIR_HLS.cpp:20->FIR_HLS.cpp:19->FIR_HLS.cpp:18) [18]  (0.000 ns)
	'load' operation 16 bit ('b_FIR_kernel_load', FIR_HLS.cpp:42->FIR_HLS.cpp:20->FIR_HLS.cpp:19->FIR_HLS.cpp:18) on array 'b_FIR_kernel' [19]  (1.237 ns)

 <State 2>: 5.870ns
The critical path consists of the following:
	'load' operation 16 bit ('b_FIR_kernel_load', FIR_HLS.cpp:42->FIR_HLS.cpp:20->FIR_HLS.cpp:19->FIR_HLS.cpp:18) on array 'b_FIR_kernel' [19]  (1.237 ns)
	'mul' operation 31 bit ('mul_ln42', FIR_HLS.cpp:42->FIR_HLS.cpp:20->FIR_HLS.cpp:19->FIR_HLS.cpp:18) [23]  (2.380 ns)
	'add' operation 32 bit ('add_ln42', FIR_HLS.cpp:42->FIR_HLS.cpp:20->FIR_HLS.cpp:19->FIR_HLS.cpp:18) [25]  (1.016 ns)
	'store' operation 0 bit ('store_ln42', FIR_HLS.cpp:42->FIR_HLS.cpp:20->FIR_HLS.cpp:19->FIR_HLS.cpp:18) of variable 'add_ln42', FIR_HLS.cpp:42->FIR_HLS.cpp:20->FIR_HLS.cpp:19->FIR_HLS.cpp:18 on array 'H_accu_FIR_kernel' [29]  (1.237 ns)


============================================================
+ Verbose Summary: Binding
============================================================
N/A
* FSMD analyzer results:
  - Output states:
 - Input state : 
  - Chain level:
	State 1
	State 2


============================================================
+ Verbose Summary: Datapath Resource usage 
============================================================
N/A
