

================================================================
== Vitis HLS Report for 'FIR_filter_2_Pipeline_VITIS_LOOP_41_1'
================================================================
* Date:           Wed Nov 12 23:19:50 2025

* Version:        2024.2 (Build 5238294 on Nov  8 2024)
* Project:        Multirate_v10
* Solution:       hls (Vivado IP Flow Target)
* Product family: zynquplus
* Target device:  xck26-sfvc784-2LV-c


================================================================
== Performance Estimates
================================================================
+ Timing: 
    * Summary: 
    +--------+----------+----------+------------+
    |  Clock |  Target  | Estimated| Uncertainty|
    +--------+----------+----------+------------+
    |ap_clk  |  10.00 ns|  4.750 ns|     2.70 ns|
    +--------+----------+----------+------------+

+ Latency: 
    * Summary: 
    +---------+---------+-----------+-----------+-----+-----+------------------------------------------------+
    |  Latency (cycles) |   Latency (absolute)  |  Interval |                    Pipeline                    |
    |   min   |   max   |    min    |    max    | min | max |                      Type                      |
    +---------+---------+-----------+-----------+-----+-----+------------------------------------------------+
    |        6|        6|  60.000 ns|  60.000 ns|    5|    5|  loop auto-rewind stp (delay=0 clock cycles(s))|
    +---------+---------+-----------+-----------+-----+-----+------------------------------------------------+

    + Detail: 
        * Instance: 
        N/A

        * Loop: 
        +-------------------+---------+---------+----------+-----------+-----------+------+----------+
        |                   |  Latency (cycles) | Iteration|  Initiation Interval  | Trip |          |
        |     Loop Name     |   min   |   max   |  Latency |  achieved |   target  | Count| Pipelined|
        +-------------------+---------+---------+----------+-----------+-----------+------+----------+
        |- VITIS_LOOP_41_1  |        4|        4|         2|          1|          1|     4|       yes|
        +-------------------+---------+---------+----------+-----------+-----------+------+----------+

============================================================
+ Verbose Summary: Synthesis Manager
============================================================
InlineROM: 1
ExposeGlobal: 0
============================================================
+ Verbose Summary: CDFG Model
============================================================
IsTopModel: 0
ResetActiveHigh: 1
IsCombinational: 0
IsDatapathOnly: 0
HasWiredReturn: 1
HasMFsm: 2
HasVarLatency: 1
IsPipeline: 0
IsRtlPipelined: 0
IsInstanceOverlapped: 0
IsDontTouch: 0
HasImplIP: 0
IsGatedGlobalClock: 0

+ Individual pipeline summary: 
  * Pipeline-0: initiation interval (II) = 1, depth = 2


============================================================
+ Verbose Summary: Schedule
============================================================
* Number of FSM states : 2
* Pipeline : 1
  Pipeline-0 : II = 1, D = 2, States = { 1 2 }
* Dataflow Pipeline: 0

* FSM state transitions: 
1 --> 2 
2 --> 

* FSM state operations: 

State 1 <SV = 0> <Delay = 1.52>
ST_1 : Operation 5 [1/1] (0.00ns)   --->   "%i = alloca i32 1" [FIR_HLS.cpp:41]   --->   Operation 5 'alloca' 'i' <Predicate = true> <Delay = 0.00>
ST_1 : Operation 6 [1/1] (0.00ns)   --->   "%sext_ln39_read = read i16 @_ssdm_op_Read.ap_auto.i16, i16 %sext_ln39"   --->   Operation 6 'read' 'sext_ln39_read' <Predicate = true> <Delay = 0.00>
ST_1 : Operation 7 [1/1] (0.00ns)   --->   "%sext_ln39_cast = sext i16 %sext_ln39_read"   --->   Operation 7 'sext' 'sext_ln39_cast' <Predicate = true> <Delay = 0.00>
ST_1 : Operation 8 [1/1] (0.42ns)   --->   "%store_ln41 = store i3 1, i3 %i" [FIR_HLS.cpp:41]   --->   Operation 8 'store' 'store_ln41' <Predicate = true> <Delay = 0.42>
ST_1 : Operation 9 [1/1] (0.00ns)   --->   "%br_ln0 = br void %for.body"   --->   Operation 9 'br' 'br_ln0' <Predicate = true> <Delay = 0.00>
ST_1 : Operation 10 [1/1] (0.00ns)   --->   "%i_2 = load i3 %i" [FIR_HLS.cpp:41]   --->   Operation 10 'load' 'i_2' <Predicate = true> <Delay = 0.00>
ST_1 : Operation 11 [1/1] (0.67ns)   --->   "%icmp_ln41 = icmp_eq  i3 %i_2, i3 5" [FIR_HLS.cpp:41]   --->   Operation 11 'icmp' 'icmp_ln41' <Predicate = true> <Delay = 0.67> <CoreInst = "Cmp">   --->   Core 9 'Cmp' <Latency = 0> <II = 1> <Delay = 0.67> <FuncUnit> <Opcode : 'seteq' 'setne' 'setle' 'setge' 'setlt' 'setgt'> <InPorts = 2> <OutPorts = 1>
ST_1 : Operation 12 [1/1] (0.00ns)   --->   "%empty = speclooptripcount i32 @_ssdm_op_SpecLoopTripCount, i64 4, i64 4, i64 4"   --->   Operation 12 'speclooptripcount' 'empty' <Predicate = true> <Delay = 0.00>
ST_1 : Operation 13 [1/1] (0.00ns)   --->   "%br_ln41 = br i1 %icmp_ln41, void %for.body.split, void %for.end.exitStub" [FIR_HLS.cpp:41]   --->   Operation 13 'br' 'br_ln41' <Predicate = true> <Delay = 0.00>
ST_1 : Operation 14 [1/1] (0.00ns)   --->   "%zext_ln41 = zext i3 %i_2" [FIR_HLS.cpp:41]   --->   Operation 14 'zext' 'zext_ln41' <Predicate = (!icmp_ln41)> <Delay = 0.00>
ST_1 : Operation 15 [1/1] (0.00ns)   --->   "%trunc_ln41 = trunc i3 %i_2" [FIR_HLS.cpp:41]   --->   Operation 15 'trunc' 'trunc_ln41' <Predicate = (!icmp_ln41)> <Delay = 0.00>
ST_1 : Operation 16 [1/1] (0.00ns)   --->   "%FIR_coe_addr = getelementptr i15 %FIR_coe, i64 0, i64 %zext_ln41" [FIR_HLS.cpp:42]   --->   Operation 16 'getelementptr' 'FIR_coe_addr' <Predicate = (!icmp_ln41)> <Delay = 0.00>
ST_1 : Operation 17 [2/2] (0.67ns)   --->   "%FIR_coe_load = load i3 %FIR_coe_addr" [FIR_HLS.cpp:42]   --->   Operation 17 'load' 'FIR_coe_load' <Predicate = (!icmp_ln41)> <Delay = 0.67> <CoreInst = "ROM">   --->   Core 100 'ROM' <Latency = 1> <II = 1> <Delay = 0.67> <Storage> <Opcode : 'load'> <Ports = 0> <Width = 15> <Depth = 5> <ROM>
ST_1 : Operation 18 [1/1] (0.00ns)   --->   "%FIR_delays_addr = getelementptr i32 %FIR_delays, i64 0, i64 %zext_ln41" [FIR_HLS.cpp:42]   --->   Operation 18 'getelementptr' 'FIR_delays_addr' <Predicate = (!icmp_ln41)> <Delay = 0.00>
ST_1 : Operation 19 [2/2] (0.67ns)   --->   "%FIR_delays_load = load i3 %FIR_delays_addr" [FIR_HLS.cpp:42]   --->   Operation 19 'load' 'FIR_delays_load' <Predicate = (!icmp_ln41)> <Delay = 0.67> <CoreInst = "RAM">   --->   Core 82 'RAM' <Latency = 1> <II = 1> <Delay = 0.67> <Storage> <Opcode : 'load' 'store'> <Ports = 2> <Width = 32> <Depth = 5> <RAM>
ST_1 : Operation 20 [1/1] (0.67ns)   --->   "%add_ln41 = add i3 %i_2, i3 1" [FIR_HLS.cpp:41]   --->   Operation 20 'add' 'add_ln41' <Predicate = (!icmp_ln41)> <Delay = 0.67> <CoreInst = "Adder">   --->   Core 1 'Adder' <Latency = 0> <II = 1> <Delay = 0.67> <FuncUnit> <Opcode : 'add' 'sub'> <InPorts = 2> <OutPorts = 1>
ST_1 : Operation 21 [1/1] (0.42ns)   --->   "%store_ln41 = store i3 %add_ln41, i3 %i" [FIR_HLS.cpp:41]   --->   Operation 21 'store' 'store_ln41' <Predicate = (!icmp_ln41)> <Delay = 0.42>
ST_1 : Operation 35 [1/1] (0.42ns)   --->   "%ret_ln0 = ret"   --->   Operation 35 'ret' 'ret_ln0' <Predicate = (icmp_ln41)> <Delay = 0.42>

State 2 <SV = 1> <Delay = 4.75>
ST_2 : Operation 22 [1/1] (0.00ns)   --->   "%specpipeline_ln41 = specpipeline void @_ssdm_op_SpecPipeline, i32 4294967295, i32 0, i32 0, i32 0, void @empty_1" [FIR_HLS.cpp:41]   --->   Operation 22 'specpipeline' 'specpipeline_ln41' <Predicate = true> <Delay = 0.00>
ST_2 : Operation 23 [1/1] (0.00ns)   --->   "%specloopname_ln41 = specloopname void @_ssdm_op_SpecLoopName, void @empty_5" [FIR_HLS.cpp:41]   --->   Operation 23 'specloopname' 'specloopname_ln41' <Predicate = true> <Delay = 0.00>
ST_2 : Operation 24 [1/2] ( I:0.67ns O:0.67ns )   --->   "%FIR_coe_load = load i3 %FIR_coe_addr" [FIR_HLS.cpp:42]   --->   Operation 24 'load' 'FIR_coe_load' <Predicate = true> <Delay = 0.67> <CoreInst = "ROM">   --->   Core 100 'ROM' <Latency = 1> <II = 1> <Delay = 0.67> <Storage> <Opcode : 'load'> <Ports = 0> <Width = 15> <Depth = 5> <ROM>
ST_2 : Operation 25 [1/2] ( I:0.67ns O:0.67ns )   --->   "%FIR_delays_load = load i3 %FIR_delays_addr" [FIR_HLS.cpp:42]   --->   Operation 25 'load' 'FIR_delays_load' <Predicate = true> <Delay = 0.67> <CoreInst = "RAM">   --->   Core 82 'RAM' <Latency = 1> <II = 1> <Delay = 0.67> <Storage> <Opcode : 'load' 'store'> <Ports = 2> <Width = 32> <Depth = 5> <RAM>
ST_2 : Operation 26 [1/1] (0.00ns)   --->   "%sext_ln42_1 = sext i15 %FIR_coe_load" [FIR_HLS.cpp:42]   --->   Operation 26 'sext' 'sext_ln42_1' <Predicate = true> <Delay = 0.00>
ST_2 : Operation 27 [1/1] (2.38ns)   --->   "%mul_ln42 = mul i31 %sext_ln39_cast, i31 %sext_ln42_1" [FIR_HLS.cpp:42]   --->   Operation 27 'mul' 'mul_ln42' <Predicate = true> <Delay = 2.38> <CoreInst = "Multiplier">   --->   Core 3 'Multiplier' <Latency = 0> <II = 1> <Delay = 2.38> <FuncUnit> <Opcode : 'mul'> <InPorts = 2> <OutPorts = 1>
ST_2 : Operation 28 [1/1] (0.00ns)   --->   "%shl_ln3 = bitconcatenate i32 @_ssdm_op_BitConcatenate.i32.i31.i1, i31 %mul_ln42, i1 0" [FIR_HLS.cpp:42]   --->   Operation 28 'bitconcatenate' 'shl_ln3' <Predicate = true> <Delay = 0.00>
ST_2 : Operation 29 [1/1] (1.01ns)   --->   "%add_ln42 = add i32 %FIR_delays_load, i32 %shl_ln3" [FIR_HLS.cpp:42]   --->   Operation 29 'add' 'add_ln42' <Predicate = true> <Delay = 1.01> <CoreInst = "Adder">   --->   Core 1 'Adder' <Latency = 0> <II = 1> <Delay = 1.01> <FuncUnit> <Opcode : 'add' 'sub'> <InPorts = 2> <OutPorts = 1>
ST_2 : Operation 30 [1/1] (0.54ns)   --->   "%add_ln42_1 = add i2 %trunc_ln41, i2 3" [FIR_HLS.cpp:42]   --->   Operation 30 'add' 'add_ln42_1' <Predicate = true> <Delay = 0.54> <CoreInst = "Adder">   --->   Core 1 'Adder' <Latency = 0> <II = 1> <Delay = 0.54> <FuncUnit> <Opcode : 'add' 'sub'> <InPorts = 2> <OutPorts = 1>
ST_2 : Operation 31 [1/1] (0.00ns)   --->   "%zext_ln42 = zext i2 %add_ln42_1" [FIR_HLS.cpp:42]   --->   Operation 31 'zext' 'zext_ln42' <Predicate = true> <Delay = 0.00>
ST_2 : Operation 32 [1/1] (0.00ns)   --->   "%FIR_delays_addr_1 = getelementptr i32 %FIR_delays, i64 0, i64 %zext_ln42" [FIR_HLS.cpp:42]   --->   Operation 32 'getelementptr' 'FIR_delays_addr_1' <Predicate = true> <Delay = 0.00>
ST_2 : Operation 33 [1/1] ( I:0.67ns O:0.67ns )   --->   "%store_ln42 = store i32 %add_ln42, i3 %FIR_delays_addr_1" [FIR_HLS.cpp:42]   --->   Operation 33 'store' 'store_ln42' <Predicate = true> <Delay = 0.67> <CoreInst = "RAM">   --->   Core 82 'RAM' <Latency = 1> <II = 1> <Delay = 0.67> <Storage> <Opcode : 'load' 'store'> <Ports = 2> <Width = 32> <Depth = 5> <RAM>
ST_2 : Operation 34 [1/1] (0.00ns)   --->   "%br_ln41 = br void %for.body" [FIR_HLS.cpp:41]   --->   Operation 34 'br' 'br_ln41' <Predicate = true> <Delay = 0.00>


============================================================
+ Verbose Summary: Timing violations
============================================================
Target clock period: 10.000ns, clock uncertainty: 2.700ns.

 <State 1>: 1.527ns
The critical path consists of the following:
	'store' operation 0 bit ('store_ln41', FIR_HLS.cpp:41) of constant 1 on local variable 'i', FIR_HLS.cpp:41 [7]  (0.427 ns)
	'load' operation 3 bit ('i', FIR_HLS.cpp:41) on local variable 'i', FIR_HLS.cpp:41 [10]  (0.000 ns)
	'add' operation 3 bit ('add_ln41', FIR_HLS.cpp:41) [31]  (0.673 ns)
	'store' operation 0 bit ('store_ln41', FIR_HLS.cpp:41) of variable 'add_ln41', FIR_HLS.cpp:41 on local variable 'i', FIR_HLS.cpp:41 [32]  (0.427 ns)

 <State 2>: 4.750ns
The critical path consists of the following:
	'load' operation 15 bit ('FIR_coe_load', FIR_HLS.cpp:42) on array 'FIR_coe' [20]  (0.677 ns)
	'mul' operation 31 bit ('mul_ln42', FIR_HLS.cpp:42) [24]  (2.380 ns)
	'add' operation 32 bit ('add_ln42', FIR_HLS.cpp:42) [26]  (1.016 ns)
	'store' operation 0 bit ('store_ln42', FIR_HLS.cpp:42) of variable 'add_ln42', FIR_HLS.cpp:42 on array 'FIR_delays' [30]  (0.677 ns)


============================================================
+ Verbose Summary: Binding
============================================================
N/A
* FSMD analyzer results:
  - Output states:
 - Input state : 
  - Chain level:
	State 1
	State 2


============================================================
+ Verbose Summary: Datapath Resource usage 
============================================================
N/A
